source,content
haberturk,"İstanbul'da olay, 13 Nisan 2022 tarihinde Molla Gürani Mahallesi Akkoyunlu Sokak'ta bir apartmanda yaşandı. Anne Chaimae El Omarı'nın (31) ifadelerine göre, o gece Yusuf adını verdiği 2.5 aylık bebeğine süt verdikten sonra yanında uyuttu.DHA'da yer alan habere göre sabaha karşı saat 04.00 sıralarında uyanan kadın, bebeğini göremeyince salona geçti, bebeğini yüzüstü yatar halde ve morarmış halde buldu. Mısır'a giden kocasının arkadaşı olan ve zaman zaman da kendisine yardımcı olduğu için evlerinde kaldığını söylediği Cherif Cossaw'ı (31) da odada oturur halde uyurken gördü.Cherif'i ayağıyla vurarak uyandıran kadın, ne yaptığını sordu, adam da yerinden kalkmayarak rahat tavırlar sergiledi. Bunun üzerine anne Chaimae, kocasının arkadaşlarını telefonla aradı, kocasının arkadaşlarından biri geldi ve bebeği hemen hastaneye götürdüler. Ancak sabah saat 06.30 sıralarında bebeğin öldüğü haberi verildi. Bunun üzerine anne Chaimae, CherifCossaw'dan bebeğini öldürdüğü düşüncesiyle şikayetçi oldu.O gün evden ayrılan Cherif'in ifadesi alınamadı. Anne Chaimae'nin ise ""şikayetçi"" sıfatıyla polis karakolunda ifadesi alındı. Anne Chaimae, olaydan 4 gün önce Cherif'e evin anahtarını verdiğini, olay gecesi bebeğiyle uyuduklarını, saat 02.00'da bebeğin altını değiştirdiğini, bu esnada Cherif'in evde olmadığını, saat 04.00 sularında uyandığında bebeğini yanında olmadığını fark edince salonda yüzüstü gördüğünü ve Cherif'in bebeğini öldürmüş olduğunu söyledi.Olay gününe ait apartmanın kamera kayıtlarının incelenmesinde, Cherif'in 12 Nisan 2022 tarihinde saat 18.51 sularında bina içerisine girdiği, sabaha karşı saat 04.32 sularında binadan çıktığı görüldü. Saat 04.39 sularında 3 erkeğin bina içerisine girdiği, saat 04.42 sularında içeri girenlerden birinin telefonla konuşarak koşar vaziyette binadan çıktığı, saat 05.47'de diğer iki erkeğin dışarı çıktığı, bu kişilerden birinin kucağında bebeğin olduğu, arkalarından da annenin koşar vaziyette binadan çıktığı belirlendi.Annenin ifadesiyle, kamera kayıtlarının çeliştiği ortaya çıktı. Chaimae'nin bu kez ""şüpheli"" sıfatıyla ifadesi alındı. Anne, olay günü evinde kimsenin olmadığını, saat 00.10 sularında bebeğine süt verip uyuduklarını, uyanana kadar da Cherif'in evde olmadığını, Cherif'in geldikten sonra bebeği yanından aldığını ve salonda kucağından düşürdüğünü düşündüğünü söyledi.Bebeğin otopsisinde, iç ve dış muayenesinde yaralanma bulunmadığı, ancak kanında uyuşturucu uyarıcı maddelerden metamfetamin bulunduğu, idrarda uyuşturucu uyarıcı maddelerden metamfetamin ile ilaç etkin maddelerinden lidokain bulunduğu, göz içi sıvısında metamfetamin bulunduğu, ölümün uyarıcı madde zehirlenmesi sonucu meydana geldiği tespiti yapıldı. Evde bulunan mamada içinde ise uyuşturucu veya uyarıcı bir madde bulunmadı.Bunun üzerine savcılık, olay günü evden ayrılan Cherif Cossaw hakkında yakalama kararı çıkardı. Şüpheli annenin savcılıkça alınan ifadesinde de, Cherif'i olaydan sonra görmediğini, hamile kalmadan önce uyuşturucu madde kullandığını, bebeğin doğmasının ardından uyuşturucu kullanmadığını söyledi.Anne Chaimae, diğer şüpheli Cherif'in uyuşturucu kullandığını bildiğini ancak evde içmediğini, bebeğinin neden öldüğünü bilmediğini, polise Cherif'in öldürmüş olabileceğini söylediğini, bebeği öldürmediğini söyledi.Bunun üzerine şüpheli Chaimae El Omarı, 1 Mart 2023 tarihinde tutuklanarak cezaevine gönderildi. Soruşturmayı tamamlayan savcılık, her iki sanık hakkında fikir ve eylem birliği içerisinde bebeğe uyuşturucu madde vererek zehirledikleri ve ölümüne sebebiyet verdikleri gerekçesiyle ""Çocuğa karşı kasten öldürme"" suçundan ağırlaştırılmış müebbet hapis istemiyle dava açtı.İstanbul Ağır Ceza Mahkemesinde görülen davada, ölen bebek El Omarı'nın ölüm saati ve uyuşturucu maddenin ölüm saatinden ne kadar zaman önce verilmiş olabileceği konusunda Adli Tıp Kurumu 1. Adli Tıp İhtisas Kurulundan hazırlanan rapor ulaştı.Bu raporda, ""Bebeğin ölümünün 13 Nisan 2022 tarihi saat 05.00'dan önceki 6 saatlik zaman dilimi içerisinde gerçekleşmiş olduğu, ölümüne neden olan uyarıcı maddenin anne sütüyle bebeğe geçmiş olabileceği gibi gıdalarla veya sulandırılarak ağız yoluyla da verilebileceği, mevcut verilerle bu iki durum arasında tıbben ayrım yapılamadığı, ölümüne neden olan uyarıcı maddelere ölümünden önceki 24 saat içerisinde maruz kalınmış olduğu"" belirtildi.Davalar devam ederken Cherif Cossaw, 28 Eylül 2023'te yakalanarak tutuklandı. Chaimae ve eşiyle 4 yıl önce komşuluk yaptıkları için tanıştıklarını, Chaimae'nin eşi cezaevine gönderilince kendisine zaman zaman uğrayarak bebek bezi, süt, mama götürdüğünü, aralarında ilişki olmadığını söyleyen Cossaw, Chaimae'nin evinde uyuşturucu kullandığını belirterek ""Chaimae, metamfetamin kullanırdı, bazı zamanlarda üç gün uyuyamazdı, ben o dönemde metamfetamin kullanmazdım. Olay günü gece saat 02.00 - 03.00 arası bir saatte gittiğimi hatırlıyorum, dışarıda hap ve esrar kullanmıştım.Eve gittim, evde de esrar kullanmak için sararken uyuyup kalmışım. Eve gittiğimde diğer sanık odada uyuyordu, bebek de yanında yatıyordu, odanın kapısı açıktı, oradan baktım ve salona geçtim. Onun evi benim evim gibiydi. Gece çocuğa el sürmedim. Çocuğun ne şekilde öldüğünü bilmiyorum. Bebeği yerde görmedim"" dedi.Davanın 12 Aralık 2023 tarihinde görülen 6'ıncı duruşmasında, sanık Cherif'in sevgilim dediği Fas uyruklu Fatiha Saber cezaevinden getirilerek tanık olarak dinlendi. Saber, olay sabahı Chaimae'nin çocuğunun öldüğünü söyleyerek kendisini aradığını, anneyle birlikte hastaneye gittiklerini, olaydan bir gün önce gündüz saatlerinde Chaimae'nin evine gittiğini, sonrasında Cherif'in geldiğini, saat 16.30 sıralarında yalnız ayrıldığını anlattı.Kendisi de daha önceden uyuşturucu kullandığını söyleyen Saber, Cherif'in uyuşturucu kullandığını, ancak Chaimae'nin evinde kullandığını görmediğini, Chaimae'nin de hamileyken uyuşturucu kullandığını görmediğini iddia etti. Saber Chaimae'nin kendisi uyuduğunda ya da başka zaman bebeğin bakımını kendisine veya Cherif'e bırakmadığını da ifade etti.Son duruşmada söz alan anne Chaime El Omarı, ""Asıl mağdur benim, bebeğim öldü, uzun süredir tutukluyum, tahliyemi isterim"" derken, Cherif Cossaw ise bebeğin ölümüyle ilgisi olmadığını söyleyerek, ""Tahminime göre diğer sanık gece uyurken çocuğun üzerine yattı, çocuk ölünce de bu hikayeyi uydurdu. Tahliyemi talep ederim"" dedi.Mahkeme başkanı, suçun niteliğinin TCK'nin 85/1. maddesine (Taksirle öldürme) dönüşebileceği kanaatiyle sanıklara ek savunma verdi. Sanıklar eski savunmalarını tekrar ettiler. Mahkeme heyeti, suçun niteliğinin değişmesi olasılığı dikkate alınarak yurt dışına çıkışlarının yasaklanması ve her hafta en yakın karakola imza atmaları şartıyla iki sanığın da tahliyesine karar verdi.Mahkeme, sanıkların tahliyelerinin ardından İstanbul İl Göç İdari Müdürlüğüne teslim edilmelerine karar verdi. Suçun niteliği ""Taksirle öldürme"" suçuna dönüşürse ve ""olası kast"" hükümleri de uygulanırsa, ağırlaştırılmış müebbet hapisle yargılanan iki sanığa verilecek ceza oranı da düşecek."
haberturk,"Narkotik Vaka Analiz Sistemi (NARVAS) Projesi, 30 büyükşehirde uygulanmaya başlanırken, polis ve jandarma ekipleri ile vatandaşın işbirliği önemli sonuçlar verdi.Çocuklarımızı zehirleyen uyuşturucu kaçakçıları, mahalle aralarındaki satıcılar ve torbacılara ağır darbeler vurulurken, suçun işlenmesinde kullanılan kiralık araçlarla ilgili yeni yasal düzenlemelere gidiliyor.Artık birden fazla uyuşturucu yakalamasında aracın sahibi, “Bilgim yok; iyi niyetli olarak aracımı verdim ya da kiraladım” diyemeyecek. İki kez uyuşturucu yakalanan araç sahibi de uyuşturucu kaçakçılığından işlem görecek.İçişleri Bakanı Ali Yerlikaya uyuşturucuyu, “çağın vebası” olarak değerlendirmiş ve teşkilatına, “Hamsilerle değil, orkinoslarla uğraşmanızı istiyorum. Torbacıyı, satıcıyı yakalamak önemli ama bunları yakaladığınızda bir süre sonra yerlerine yenileri geliyor. Bunların elebaşlarını, ağa babalarını yakaladığımızda ancak bataklığı kurutabiliriz, bunların kökünü kazıyabiliriz” mesajını vermişti.Bakan Yerlikaya, kısa süre önce NARVAS Projesi’ni tanıtmış ve bununla 112 UYUMA Mobil Uygulaması üzerinden gelen narkotik ihbarların, daha etkin analizinin sağlandığını açıklamıştı.NARVAS, vatandaşlar tarafından yapılan bildirim ve ihbarların analiz edilmesine, analize dayalı yoğunluk haritalarının oluşturulmasına, suçluların tespiti ve yakalanmasına, yer ve zaman odaklı mücadele planları ile stratejilerin hazırlanmasına olanak sağlayan bir yazılım…Polis ve jandarma ekipleri, NARVAS’a gelen bütün ihbarları doğru kabul ederek işlem başlatıyor. İhbarların yoğun olarak yapıldığı yerlere kolluk güçleri anında baskın yapıyor. Hangi saatlerde, hangi sokak başında, hangi noktada uyuşturucu satışı yapılıyorsa, en ücra yerler dahi bu sistemle tespit edilerek satıcılar ani baskınlarla tepelerine çökülüyor.NARVAS’la aynı zamanda suç haritaları hazırlanıyor ve böylelikle riskli bölgeleri tespit ediliyor; Narko Alan Bölgeleri oluşturuyor. Sisteme narkotik şikâyetler kapsamında kasım ayında 9 bin 675 ihbar gelirken, NARVAS kapsamında 59 bin kişi sorgulandı, 124 kişiye narkotik suçlarından işlem yapıldı. Çeşitli suçlardan aranan 503 kişi yakalandı. NARVAS Projesi, 1 Ocak’tan itibaren 81 ilde yaygınlaşacak.Kasım ayı itibariyle son altı ayda uyuşturucuya yönelik toplam 132 bin 537 operasyon düzenlendi. Bu operasyonlar sonucunda 15 bin 280 kişi tutuklandı. 6 bin 143 kişi hakkında ise adli kontrol kararı verildi.Mücadelenin yasal ayağı da en az sahadaki mücadele kadar önemli. İşte bu noktada uyuşturucu kaçakçılığı ya da ticareti suçunun işlenmesinde kullanılan kiralık araçlar ve iyi niyetli malik uygulamasında yeni bazı düzenlemeler yapılıyor. Suçta kullanılan aracın müsaderesi ve iyi niyetli üçüncü kişi konumundaki sahibinin de sorumlu tutulması uyuşturucu ticaretinin önlenmesinde önemli bir adım olacak.Örneğin araçta uyuşturucu yakalamalarında aracın sahibi çoğu zaman, “Hastam var dedi benden aracı istedi; kıramadım verdim” diyor. Bunun dışında uyduruk bir kiralık sözleşmesi yaparak, “aracımı şu kişiye kiraladım” diyor ve yargılanmaktan kurtuluyor. Yeni düzenlemede aynı araçta birden fazla uyuşturucu madde yakalanması durumunda araç sahibine de uyuşturucu kaçakçılığı işlemi yapılacak. Bu gibi durumlarda aracın sahibinin, “iyi niyet” iddiası göz ardı edilecek. Yapılacak yasal düzenlemede, “birden fazla yakalamada iyi niyet aranmaz” hükmü konulacak.Yargıtay Ceza Genel Kurulu kararları da bazı zamanlarda uyuşturucu baronlarıyla mücadele eden kolluk güçlerini kısıtlayıcı rol oynayabiliyor. Kolluk güçleri bir yere baskın düzenlediğinde; şahısların üzerinde, araçta veya kapalı bir yerde uyuşturucu yakaladığında arama izni yoksa mahkeme, bu konuda verilen cezayı arama izni olmadığı gerekçesiyle iptal edebiliyor; şahıs beraat ediyor. Bu nedenle detaylı arama, araç veya üst aramalarında mutlak suretle arama izni gerekiyor.Kolluk güçlerine bu noktada hizmet içi eğitimlerle ve talimatlarla arama izni almanın önemi anlatılıyor. Suçüstü durumunda kullanılan acil arama izni gerektiğinde Whatsapp mesajıyla dahi nöbetçi mahkemeden alınabiliyor. Bu sıkılaştırma ve hassasiyet sonucunda gözaltının ardından tutuklamalar yüzde 90 oranında arttı. Mücadele kararlılıkla devam ediyor."
haberturk,"CHP Genel Başkanı Özgür Özel, Tuzla Piyade Okulu'nda 10 Kasım töreninde yaşanan olaya ilişkin, ""Siz bu tarikat ve cemaatlere Atatürk'ün ordusunu açarsanız, onların orada yerleşmesine, onların orada yapılanmasına izin verirseniz, günü geldiğinde bunlar, Atatürk'ün resmini takmayacak hadsizliği gösterirler. Siz, 15 Temmuz'dan hiç mi ders almadınız?"" dedi.Özgür Özel, Tuzla Piyade Okulu'nda 10 Kasım töreninde yakalarına Atatürk rozeti takmayı reddeden 3 teğmen ve onlara itiraz eden 4 arkadaşı arasında geçenleri dikkatle takip ettiğini belirtti. Özel, ""Bir soruşturma açıldığını duymuştum ve meseleyi o günden beri yakından takip ediyorum. Öğrendim ki 7'si birden amirleri ile birlikte açığa alınmışlar. Yakalarına Atatürk rozeti takmayı reddeden teğmenlerin mazeretini beyan etmek, alenileştirmek ve savunmak da Milli Savunma Bakanı Yaşar Güler'e düşmüş"" diye konuştu.Milli Savunma Bakanı Yaşar Güler'in konuya ilişkin, ""Bir tane öğrenci subayımız, yakasına takması gereken fotoğrafı takmıyor ve 'toplu iğnem yok onun için takamadım' gibi bir gerekçe ortaya sürüyor"" açıklaması yaptığını belirten Özel, ""Ne fotoğrafı? Niye söylemiyorsun, 'Atatürk fotoğrafını' diye de sadece 'fotoğrafı' diyorsun. 'Toplu iğne olmadığı için takmayan' savunmasını yapmak, avukatlığını yapmak size mi düştü? Onlara itiraz eden 4 teğmen, Atatürk'ün ocağında, Atatürk'ün resmini yakasını takmayan tarikatçılara itiraz ediyor. Öyle toplu iğnenin yokluğundan olsa onu herkes bilir ve o ihtiyaç hemen giderilir. Onların ne niyette oldukları, niye takmadıkları ve esas olarak neyi amaçladıklarını elbette biliyorlar. İşin daha pis kokan tarafı da ne biliyor musunuz? Bu açıklamadan 4-5 gün önce Yeni Şafak gazetesi, 'teğmenler cuntası' diye haber yaparak, yakalarına Atatürk resmi takmayanları değil de onlara tepki gösterenleri 'cunta' diye yaftalayarak, FETÖ taktiklerine başvurmuş ve bugün ortaya çıkacak olan bu haberlerin psikolojik altyapısını hazırlamıştı. Tam da sorun burada işte. Siz bu tarikat ve cemaatlere Atatürk'ün ordusunu açarsanız, onların orada yerleşmesine, onların orada yapılanmasına izin verirseniz, günü geldiğinde bunlar, Atatürk'ün resmini takmayacak hadsizliği gösterirler. Siz, 15 Temmuz'dan hiç mi ders almadınız? 15 Temmuz'da Atatürk'ün resmini savunanlar değil; Atatürk'ün resmini takmak istemeyenler, Atatürk'e husumet duyanlar, Atatürk'ten nefret edenler darbeye kalkıştı. Sonra ne oldu? Hepiniz apar topar Atatürk fotoğraflarına sarıldınız"" dedi."
haberturk,"Burcu Erdanlı, 2014 yılında tanıştığı Mustafa Ali Ayda ile evlendi. Çiftin geçen 9 yıl içinde, 4 çocukları dünyaya geldi. Uyuşturucu kullandığı iddia edilen Mustafa Ali Ayda'nın uyguladığı şiddet ve hakaretlere dayanamayan Burcu Ayda, Bursa Cumhuriyet Savcılığı'na şikayette bulunarak, 9 yıllık eşi hakkında 2 aylık uzaklaştırma kararı aldırdı.Anne ve babası Yozgat'ta yaşayan Burcu Ayda, çocukları Z.A. (9), B.A. (6), Ü.A. (5) ve Y.A. (2) ile anneannesinin evine sığındı. İddiaya göre hakkındaki uzaklaştırma kararı biten ve eşinin kaldığı anneannesinin evine giden Mustafa Ali Ayda, ""Ben değiştim. Artık sana ve çocuklarıma zarar vermeyeceğim. Evimize gidelim"" dediği Burcu Ayda'yı ikna etti. Çift, 4 çocuklarıyla merkez Yıldırım ilçesi Değirmenönü Mahallesi 1. Oylat Sokak´ta bulunan evlerine döndü.Mustafa Ali Ayda, hakkındaki 2 aylık uzaklaştırma kararı bitip evine getirdiği eşini, 11 gün sonra, 17 Aralık saat 04.30 sıralarında, çocuklarının gözü önünde sol göğsünden bıçaklayarak kaçtı. Burcu Ayda´nın ve çocuklarının çığlıklarını duyarak yardıma koşan komşuları, kadını kapının girişinde kanlar içinde yatarken gördü.Komşularının ihbarı üzerine olay yerine polis ve sağlık ekibi sevk edildi. Sağlık ekipleri ağır yaralı olan Ayda´yı dakikalarca kalp masajı yaparak hayata döndürmeye çalışırken, çevredekiler o anları cep telefonu ile görüntüledi. 4 çocuk annesi kadın, kaldırıldığı Kestel Devlet Hastanesi´nde müdahaleye rağmen kurtarılamadı.İl Emniyet Müdürlüğü Asayiş Şube Müdürlüğü Cinayet Büro Amirliği ekipleri, olayın ardından kaçan Mustafa Ali Ayda´yı, gelen ihbar üzerine, 8 saat sonra merkez Osmangazi ilçesinde bulunan bir fırının bodrum katında saklandığı sırada yakaladı.Sorgulanmak üzere Asayiş Şube Müdürlüğü'ne götürülen Ayda, ilk ifadesinde, ailevi nedenler yüzünden çıkan tartışmanın ardından Burcu Ayda'yı bıçakladığını itiraf etti. ""O gece kendisiyle konuşmak istedim. Bağırıp hakaret ettikten sonra, mutfağa su içmeye gidince ben de onu bıçakladım"" dediği öğrenilen Ayda, emniyetteki işlemlerinin ardından sevk edildiği adliyede çıkarıldığı mahkemece tutuklanarak cezaevine gönderildi.Öte yandan anneleri gözlerinin önünde öldürülen 2´si erkek 4 çocuk, Aile ve Sosyal Hizmetler İl Müdürlüğü tarafından koruma altına aldı. Mustafa Ali Ayda´nın babası Medeni Ayda, devlet korumasını kabul etmeyerek, torunlarının bakımını üstlendi. Dedelerinin yanında kalmaya başlayan Ayda kardeşlere, Aile ve Sosyal Hizmetler İl Müdürlüğü´nün görevlendirdiği psikolog tarafından destek veriliyor.4 çocuk annesi kadının sağlık ekipleri tarafından kalp masajı yapılarak hayata döndürülmeye çalıştığı anların cep telefonu görüntüsü de ortaya çıktı"
haberturk,"Batman Valiliği tarafından, 14'üncü İnsansız Uçak Sistemleri (İUS) Üs Komutanlığı'nda, 20 Aralık'ta olacak uçaksavar atışları nedeniyle açıklama yapıldı.DHA'da yer alan habere göre valilik açıklamasında, ""Batman 14'üncü İUS Üs Komutanlığı Uçaksavar Tabur Komutanlığı'nca 20 Aralık 2023 Çarşamba günü saat 10.00 ile 14.00 arasında L-70 manevra mermi atışları olacaktır.Belirtilen saatlerde yapılacak atışlardan dolayı yüksek patlama sesi olabileceğinden vatandaşlarımızın paniğe kapılmamaları önemle rica olunur"" denildi."
haberturk,"Emekli Tümgeneral Ethem Büyükışık, yüksekten düştüğü ya da intihar ettiği iddia edilen oğlunun şüpheli ölümünü 5 yıldır aydınlatmak için mücadele veriyor. Acılı baba, ""Biricik oğlum vücudunda tek bir çizik, kıyafetlerinde yırtık olmadan nasıl olur da 27 metreden düşer"" diye soruyor.Yıllardır olayın peşini bırakmayan emekli Tümgeneral'e göre artık tüm deliller cinayete işaret ediyor. Son gelişme ise kritik bir öneme sahip. Adalet Bakanlığı, soruşturma dosyasının İzmir Cumhuriyet Başsavcılığı'ndan Ankara’ya aldı. Dosya kanun yararına bozuldu. Dosya yeniden yargılanma yapılmak üzere Yargıtay’a gönderildi.Emekli Tümgeneral Ethem Büyükışık, o günden bugüne yaşananları olay yerinde Habertürk'e anlatmıştı. Oğlu Dorukhan'ın yüksekten düşerek ölmediğini, cinayete kurban gittiğini kanıtlamaya çalıştı. Israrla oğlunun ölümüyle ilgili sahte delillerin üretildiğini iddia etti.Kamuoyunda ses getiren acılı babayı dinleyen Adalet Bakanı Yılmaz Tunç'un girişimleriyle dosya yeni boyut kazandı. Adalet arayan acılı babanın dosyayla ilgili ""kanun yararına bozma"" talebi kabul edildi.26 yaşındaki Dorukhan Büyükışık, 2018 yılında evlerinin yakınında gece yarısı yürüyüşe gitmişti. Ertesi sabah bir inşaat alanında cansız bedeni bulundu. Emekli Tümgeneral dedektif gibi iz sürerken Adli Tıp Kurumu'nun ""yüksekten düşme ve darp"" raporuna itirazları olmuştu.Yıllardır organize bir suç çetesinin oğlunu ölüme götürdüğünü iddia eden emekli tümgeneralin tüm iddiaları dosyada yerini aldı. Gerçek dışı olarak görülen şüpheleri, esrarengiz ölümün yeniden araştırılması için yeni bir yol açtı. Dosya İzmir’den Ankara’ya alındı.Kanun yararına bozma kararında şu ifadelere yer verildi:""Yukarıda zikredilen birden çok rapor ve mütalaada ölümün şüpheli olabileceğine ilişkin değerlendirme ve tespitte bulunulması, öte yandan inceleme konusu İzmir Cumhuriyet Başsavcılığı'nın 2018/60988 dosya numaralı soruşturmasıyla paralel olarak, müteffanın ölümüne ilişkin soruşturmada görev olan kolluk görevlileri haklarında şüphelilerle işbirliği içinde hareket ederek suç delillerini yok etme, gizleme veya değiştirme ve görevi kötüye kullanma suçlarını işledikleri iddiasıyla İzmir Cumhuriyet Başsavcılığı'nın 2021/106697 dosya numaralı soruşturmasının hâlen derdest olduğunun belirtilmesi karşısında,Öncelikle şüpheli ölüm olayına ilişkin inceleme konusu İzmir Cumhuriyet Başsavcılığı'nın 2018/60988 sayılı soruşturma dosyası ve ilgili kolluk görevlileri haklarında suç delillerini yok etme, gizleme veya değiştirme ve görevi kötüye kullanma suçlarından İzmir Cumhuriyet Başsavcılığı'nın 2021/106697 numaralı soruşturma dosyasının birbirine paralel olarak yürütülmesi gerektiği, her iki dosyada da elde edilecek delillerin diğer dosyadaki soruşturmayı etkilemesinin kaçınılmaz olduğu, bu bağlamda şüpheli kolluk görevlileri haklarındaki 2021/106697 numaralı soruşturma dosyasındaki tüm bilgi ve belge örneklerinin inceleme konusu 2018/60988 sayılı soruşturma dosya kapsamına getirtilmesi, her iki dosya kapsamında elde edilen bilgi, belge ve tüm delillerin birbiri ile mukayese edilmek suretiyle yeniden değerlendirilmesi, çelişkili ve birbiri ile örtüşmeyen hususlarda şüpheli, tanık ve ilgililerin beyanlarına başvurulması ve gerek görülmesi hâlinde olay yerinde keşif icra edilmek suretiyle alanında uzman bilirkişi ve kurumlardan bilirkişi raporu aldırılarak olayın aydınlatılmasına yarar delillerin toplanması sonrasında yapılacak inceleme sonucuna göre şüphelilerin hukukî durumunun takdir ve tayin edilmesi,Yapılacak tüm araştırmalara rağmen şüpheliye ulaşılamaması hâlinde ise daimi arama kararı alınarak dava zaman aşımı süresinin sonuna kadar evrakın takibinin gerektiği gözetilmeksizin, eksik soruşturmaya dayalı olarak verilen kovuşturmaya yer olmadığına dair karara yönelik itiraz üzerine, soruşturmanın genişletilmesine karar verilmesi gerektiği gözetilmeden, yazılı şekilde itirazın reddine karar verilmesinde isabet görülmemiştir.""Adalet Bakanlığı dosyayı her detayıyla inceledi. Yıllardır dosya üzerinde acısını bir tarafa koyarak delil toplayan emekli Tümgeneralin şüphelerinin olayın aydınlatılmasındaki önemi bir kez daha ortaya çıktı. Dosyada şüpheli sayısı yükseldi. İnşaat bekçisi, firma yetkilileri ile bazı kamu görevlileri şüpheli sıfatıyla dosyaya girdi.Ethem Büyükışık’ın 27 yaşındaki oğlu Dorukhan Büyükışık, 13 Mayıs 2018 tarihinde İzmir Narlıdere’de bulunan evlerinin yakınında yürüyüşe çıkmış sabah saatlerinde ise Dorukhan Büyükışık’ın cansız bedeni bölgede bulunan bir inşaat şantiyesi yanında bulunmuştu.Olay yerine gelen polisler Dorukhan Büyükışık’ın intihar ettiğini iddia etmiş ancak Adli Tıp Uzmanı ""Yüksekten düşme bulgusu yok"" demiş, buna rağmen polisler yeterli bir tahkikat yapmamıştı. Söz konusu olay yeri videolarının yıllarca saklandığı ve bölgede bulunan kamera kayıtlarının da yok edildiği tespit edilmişti.Oğlunun ölümüyle ilgili büyük bir mücadele başlatan baba Ethem Büyükışık, olayın cinayet olduğunu iddia etmişti. İddiasına ilişkin de çok sayıda resmî rapor hazırlatan baba Ethem Büyükışık’ın dosyasının kapatılması için hem jandarma, hem emniyet, hem yargı, hem de Adli Tıp’ta bulunan bazı personellerin birlikte cinayeti örtbas etmeye çalıştığını ortaya koymuştu.Jandarma Kriminal Laboravutar Amirliği de polisin olay yerinde çektiği görüntülerdeki konuşmaları değiştirerek bir rapor hazırlamıştı.Ethem Büyükışık bir an önce oğlunun ölümündeki sır perdesinin aralanmasını istiyor."
